[
  {
    "id": "dotnet_microsoft_entityframeworkcore_dbupdateexception_1",
    "language": "C#",
    "code": "Microsoft.EntityFrameworkCore.DbUpdateException",
    "category": "Database/ORM",
    "severity": "Runtime Exception",
    "title": "An error occurred while updating the entries; see inner exception for details",
    "description": "An error occurred while updating the entries; see inner exception for details.",
    "bad_example": "// Registry-only record; a minimal reproduction is pending editorial review.",
    "good_example": "// Registry-only record; a source-backed repair is pending editorial review.",
    "version_introduced": "8.0",
    "version_deprecated": null,
    "source_url": "https://learn.microsoft.com/en-us/dotnet/csharp/language-reference/compiler-messages/",
    "tier": 3,
    "frequency": "Situational",
    "situational_context": [],
    "interaction_types": [
      "runtime"
    ],
    "related_errors": []
  },
  {
    "id": "dart_lateinitializationerror_1",
    "language": "Dart",
    "code": "LateInitializationError",
    "category": "State Management",
    "severity": "Runtime Exception",
    "title": "Field 'controller' has not been initialized prior to widget tree build invocation",
    "description": "Field 'controller' has not been initialized prior to widget tree build invocation.",
    "bad_example": "// Registry-only record; a minimal reproduction is pending editorial review.",
    "good_example": "// Registry-only record; a source-backed repair is pending editorial review.",
    "version_introduced": "3.0",
    "version_deprecated": null,
    "source_url": "https://api.flutter.dev/",
    "tier": 3,
    "frequency": "Situational",
    "situational_context": [
      "Flutter widget mounting render pipeline state collision #1."
    ],
    "interaction_types": [
      "runtime"
    ],
    "related_errors": []
  },
  {
    "id": "dart_nosuchmethoderror_1",
    "language": "Dart",
    "code": "NoSuchMethodError",
    "category": "UI Lifecycle",
    "severity": "Runtime Exception",
    "title": "The method 'setState' was called on null receiver instance",
    "description": "The method 'setState' was called on null receiver instance.",
    "bad_example": "// Registry-only record; a minimal reproduction is pending editorial review.",
    "good_example": "// Registry-only record; a source-backed repair is pending editorial review.",
    "version_introduced": "3.0",
    "version_deprecated": null,
    "source_url": "https://api.flutter.dev/",
    "tier": 3,
    "frequency": "Situational",
    "situational_context": [
      "Flutter widget mounting render pipeline state collision #1."
    ],
    "interaction_types": [
      "runtime"
    ],
    "related_errors": []
  },
  {
    "id": "elixir_argumenterror_1",
    "language": "Elixir",
    "code": "ArgumentError",
    "category": "Validation",
    "severity": "Runtime Exception",
    "title": "Argument error",
    "description": "Argument error. Raised when an argument is of wrong type or invalid format.",
    "bad_example": "// Registry-only record; a minimal reproduction is pending editorial review.",
    "good_example": "// Registry-only record; a source-backed repair is pending editorial review.",
    "version_introduced": "1.12.0",
    "version_deprecated": null,
    "source_url": "https://hexdocs.pm/elixir/kernel.html",
    "tier": 3,
    "frequency": "Situational",
    "situational_context": [],
    "interaction_types": [
      "runtime"
    ],
    "related_errors": []
  },
  {
    "id": "elixir_caseclauseerror_1",
    "language": "Elixir",
    "code": "CaseClauseError",
    "category": "Control Flow",
    "severity": "Runtime Exception",
    "title": "No case clause matching the provided expression value",
    "description": "No case clause matching the provided expression value.",
    "bad_example": "// Registry-only record; a minimal reproduction is pending editorial review.",
    "good_example": "// Registry-only record; a source-backed repair is pending editorial review.",
    "version_introduced": "1.12.0",
    "version_deprecated": null,
    "source_url": "https://hexdocs.pm/elixir/kernel.html",
    "tier": 3,
    "frequency": "Situational",
    "situational_context": [],
    "interaction_types": [
      "runtime"
    ],
    "related_errors": []
  },
  {
    "id": "elixir_ecto_noresultserror_1",
    "language": "Elixir",
    "code": "Ecto.NoResultsError",
    "category": "ORM Query",
    "severity": "Runtime Exception",
    "title": "Expected at least one result for query expression, but zero rows matched",
    "description": "Expected at least one result for query expression, but zero rows matched.",
    "bad_example": "// Registry-only record; a minimal reproduction is pending editorial review.",
    "good_example": "// Registry-only record; a source-backed repair is pending editorial review.",
    "version_introduced": "1.14",
    "version_deprecated": null,
    "source_url": "https://hexdocs.pm/phoenix/overview.html",
    "tier": 3,
    "frequency": "Situational",
    "situational_context": [
      "BEAM connection handler lifecycle failure stage #1."
    ],
    "interaction_types": [
      "runtime"
    ],
    "related_errors": []
  },
  {
    "id": "elixir_keyerror_1",
    "language": "Elixir",
    "code": "KeyError",
    "category": "Collections",
    "severity": "Runtime Exception",
    "title": "The given key does not exist in the map collection structure",
    "description": "The given key does not exist in the map collection structure.",
    "bad_example": "// Registry-only record; a minimal reproduction is pending editorial review.",
    "good_example": "// Registry-only record; a source-backed repair is pending editorial review.",
    "version_introduced": "1.12.0",
    "version_deprecated": null,
    "source_url": "https://hexdocs.pm/elixir/kernel.html",
    "tier": 3,
    "frequency": "Situational",
    "situational_context": [],
    "interaction_types": [
      "runtime"
    ],
    "related_errors": []
  },
  {
    "id": "elixir_matcherror_1",
    "language": "Elixir",
    "code": "MatchError",
    "category": "Pattern Matching",
    "severity": "Runtime Exception",
    "title": "No match of right hand side value",
    "description": "No match of right hand side value. Occurs when pattern matching fails.",
    "bad_example": "// Registry-only record; a minimal reproduction is pending editorial review.",
    "good_example": "// Registry-only record; a source-backed repair is pending editorial review.",
    "version_introduced": "1.12.0",
    "version_deprecated": null,
    "source_url": "https://hexdocs.pm/elixir/kernel.html",
    "tier": 3,
    "frequency": "Situational",
    "situational_context": [],
    "interaction_types": [
      "runtime"
    ],
    "related_errors": []
  },
  {
    "id": "elixir_plug_conn_alreadysenterror_1",
    "language": "Elixir",
    "code": "Plug.Conn.AlreadySentError",
    "category": "Web Transport",
    "severity": "Runtime Exception",
    "title": "The response has already been sent to the transport client socket layer",
    "description": "The response has already been sent to the transport client socket layer.",
    "bad_example": "// Registry-only record; a minimal reproduction is pending editorial review.",
    "good_example": "// Registry-only record; a source-backed repair is pending editorial review.",
    "version_introduced": "1.14",
    "version_deprecated": null,
    "source_url": "https://hexdocs.pm/phoenix/overview.html",
    "tier": 3,
    "frequency": "Situational",
    "situational_context": [
      "BEAM connection handler lifecycle failure stage #1."
    ],
    "interaction_types": [
      "runtime"
    ],
    "related_errors": []
  },
  {
    "id": "elixir_protocol_undefinederror_1",
    "language": "Elixir",
    "code": "Protocol.UndefinedError",
    "category": "Protocols",
    "severity": "Runtime Exception",
    "title": "Protocol not implemented for the given data structure type",
    "description": "Protocol not implemented for the given data structure type.",
    "bad_example": "// Registry-only record; a minimal reproduction is pending editorial review.",
    "good_example": "// Registry-only record; a source-backed repair is pending editorial review.",
    "version_introduced": "1.12.0",
    "version_deprecated": null,
    "source_url": "https://hexdocs.pm/elixir/kernel.html",
    "tier": 3,
    "frequency": "Situational",
    "situational_context": [],
    "interaction_types": [
      "runtime"
    ],
    "related_errors": []
  },
  {
    "id": "elixir_tokenmissingerror_1",
    "language": "Elixir",
    "code": "TokenMissingError",
    "category": "Parser",
    "severity": "Compiler Error",
    "title": "Missing token/syntax error encountered during Beam File compilation parse",
    "description": "Missing token/syntax error encountered during Beam File compilation parse.",
    "bad_example": "// Registry-only record; a minimal reproduction is pending editorial review.",
    "good_example": "// Registry-only record; a source-backed repair is pending editorial review.",
    "version_introduced": "1.12.0",
    "version_deprecated": null,
    "source_url": "https://hexdocs.pm/elixir/kernel.html",
    "tier": 3,
    "frequency": "Situational",
    "situational_context": [],
    "interaction_types": [
      "parser"
    ],
    "related_errors": []
  },
  {
    "id": "elixir_undefinedfunctionerror_1",
    "language": "Elixir",
    "code": "UndefinedFunctionError",
    "category": "Modules",
    "severity": "Runtime Exception",
    "title": "Function does not exist or module is not loaded/compiled",
    "description": "Function does not exist or module is not loaded/compiled.",
    "bad_example": "// Registry-only record; a minimal reproduction is pending editorial review.",
    "good_example": "// Registry-only record; a source-backed repair is pending editorial review.",
    "version_introduced": "1.12.0",
    "version_deprecated": null,